{
  "id": "550e8400-e29b-41d4-a716-446655440001",
  "name": "Acme Workspace",
  "slug": "acme-workspace",
  "owner_email": "admin@acme.example.com",
  "plan": "pro",
  "max_sync_runs": 50,
  "settings": {
    "retry_max": 3,
    "timeout_seconds": 300,
    "notify_on_failure": true,
    "webhook_url": null
  },
  "tags": ["production", "primary"],
  "created_at": "2024-01-15T00:00:00Z",
  "suspended_until": null
}
