{
  "id": "550e8400-e29b-41d4-a716-446655440020",
  "name": "Max Tags Workspace",
  "slug": "max-tags-ws",
  "owner_email": "admin@test.example.com",
  "plan": "pro",
  "max_sync_runs": 25,
  "settings": {"retry_max": 0, "timeout_seconds": 10, "notify_on_failure": false, "webhook_url": null},
  "tags": ["t01","t02","t03","t04","t05","t06","t07","t08","t09","t10",
            "t11","t12","t13","t14","t15","t16","t17","t18","t19","t20"],
  "created_at": "2024-01-15T00:00:00Z",
  "suspended_until": null
}
